coverage/revisions/0325d878fd64f64bbd1f3517faa3f6f5065a5b77/diff/bike-ui.json

{"report_name": "LCOV", "diff_name": "cd46e69f4c2c7148a0dd0a077a522ebe66bb82ae...HEAD, staged, unstaged and untracked changes", "src_stats": {"bike-ui/components/ui/GenericList.tsx": {"percent_covered": 75.0, "violation_lines": [164], "covered_lines": [162, 169, 172], "violations": [[164, null]]}, "bike-ui/app/admin/activities/page.tsx": {"percent_covered": 84.0, "violation_lines": [107, 204, 210, 221], "covered_lines": [40, 46, 58, 64, 77, 83, 104, 105, 152, 154, 158, 167, 185, 186, 192, 193, 203, 209, 220, 224, 225], "violations": [[107, null], [204, null], [210, null], [221, null]]}, "bike-ui/components/admin/TasksPageContent.tsx": {"percent_covered": 76.19047619047619, "violation_lines": [100, 146, 215, 260, 261, 270, 279, 282, 456, 461], "covered_lines": [59, 64, 130, 131, 136, 138, 143, 144, 158, 164, 165, 172, 178, 179, 181, 188, 193, 205, 206, 221, 222, 226, 227, 236, 248, 249, 284, 427, 436, 437, 438, 451], "violations": [[100, null], [146, null], [215, null], [260, null], [261, null], [270, null], [279, null], [282, null], [456, null], [461, null]]}, "bike-ui/app/admin/integrations/page.tsx": {"percent_covered": 94.44444444444444, "violation_lines": [32, 107], "covered_lines": [20, 22, 23, 24, 31, 33, 34, 36, 39, 40, 41, 42, 44, 48, 52, 62, 63, 64, 67, 74, 75, 77, 93, 94, 96, 97, 98, 99, 119, 120, 131, 132, 146, 151], "violations": [[32, null], [107, null]]}, "bike-ui/app/admin/tasks/page.tsx": {"percent_covered": 0.0, "violation_lines": [23], "covered_lines": [], "violations": [[23, null]]}, "bike-ui/components/imports/ImportHistory.tsx": {"percent_covered": 85.71428571428572, "violation_lines": [63, 65, 67, 197], "covered_lines": [13, 18, 24, 25, 38, 43, 44, 49, 54, 60, 61, 75, 81, 82, 122, 123, 125, 126, 127, 128, 129, 183, 191, 205], "violations": [[63, null], [65, null], [67, null], [197, null]]}, "bike-ui/components/ui/DataGrid.tsx": {"percent_covered": 79.3103448275862, "violation_lines": [30, 33, 40, 52, 60, 100], "covered_lines": [1, 12, 27, 36, 43, 44, 45, 80, 99, 101, 102, 107, 108, 111, 116, 117, 124, 125, 126, 127, 128, 130, 131], "violations": [[30, null], [33, null], [40, null], [52, null], [60, null], [100, null]]}, "bike-ui/components/admin/ProcessorOverview.tsx": {"percent_covered": 68.18181818181819, "violation_lines": [65, 66, 68, 69, 70, 71, 105], "covered_lines": [9, 14, 20, 26, 27, 33, 39, 40, 47, 48, 56, 58, 59, 60, 114], "violations": [[65, null], [66, null], [68, null], [69, null], [70, null], [71, null], [105, null]]}}, "total_num_lines": 187, "total_num_violations": 35, "total_percent_covered": 81.28, "num_changed_lines": 871}

coverage/revisions/0325d878fd64f64bbd1f3517faa3f6f5065a5b77/diff/bike-ui.md

# Diff Coverage

- bike-ui/app/admin/activities/page&#46;tsx (84.0%): Missing lines 107,204,210,221
- bike-ui/app/admin/integrations/page&#46;tsx (94.4%): Missing lines 32,107
- bike-ui/app/admin/tasks/page&#46;tsx (0.0%): Missing lines 23
- bike-ui/components/admin/ProcessorOverview&#46;tsx (68.2%): Missing lines 65-66,68-71,105
- bike-ui/components/admin/TasksPageContent&#46;tsx (76.2%): Missing lines 100,146,215,260-261,270,279,282,456,461
- bike-ui/components/imports/ImportHistory&#46;tsx (85.7%): Missing lines 63,65,67,197
- bike-ui/components/ui/DataGrid&#46;tsx (79.3%): Missing lines 30,33,40,52,60,100
- bike-ui/components/ui/GenericList&#46;tsx (75.0%): Missing lines 164